{
  "$schema": "https://raw.githubusercontent.com/Netis/olympus/main/schema/olympus.schema.json",
  "project": {
    "name": "my-service",
    "default_branch": "main"
  },
  "agents": {
    "review_bot_login": "themis",
    "dev_agent_name": "hephaestus"
  },
  "labels": {
    "assess": "agent:assess",
    "try": "agent:try",
    "skip": "agent:skip",
    "auto_agent": "auto-agent",
    "discussing": "agent:discussing",
    "staging_soaked": "staging-soaked",
    "soak_failed": "soak-failed"
  },
  "triage": {
    "gates": {
      "max_loc": 300,
      "max_files": 10,
      "contained_areas": ["one package", "docs/", "one workflow"],
      "test_hint": "a unit / integration test"
    },
    "language": "auto",
    "max_discussion_rounds": 4
  },
  "implement": {
    "build_cmd": "make build && make test"
  },
  "testing": {
    "enabled": false,
    "deploy_cmd": "make deploy-staging",
    "health_cmd": "curl -fsS http://localhost:8080/healthz",
    "soak_minutes": 30,
    "teardown_cmd": "make teardown-staging",
    "fast_path": { "max_loc": 40, "max_files": 3, "areas": ["docs/"] }
  },
  "observer": {
    "service_name": "my-service",
    "health_url": "",
    "repo": "Netis/my-service",
    "labels": "incident",
    "readiness": {
      "jq": ".status",
      "expect": "ok"
    }
  },
  "model": "claude-3-5-sonnet-20241022",

  "harness": {
    "kind": "claude"
  }
}
